<?xml version="1.0" encoding="utf-8"?>
<dataMap xmlns="http://cayenne.apache.org/schema/15/dataMap"
	 xmlns:xsi="http://www.w3.org/2001/XMLSchema-instance"
	 xsi:schemaLocation="http://cayenne.apache.org/schema/15/dataMap https://cayenne.apache.org/schema/15/dataMap.xsd"
	 defaultPackage="org.apache.cayenne.testdo.table_primitives">
	<dbEntity name="TABLE_PRIMITIVES">
		<dbAttribute name="BOOLEAN_COLUMN" type="BOOLEAN"/>
		<dbAttribute name="ID" type="INTEGER" primaryKey="true" mandatory="true"/>
		<dbAttribute name="INT_COLUMN" type="INTEGER"/>
	</dbEntity>
	<objEntity name="TablePrimitives" className="org.apache.cayenne.testdo.table_primitives.TablePrimitives" dbEntityName="TABLE_PRIMITIVES">
		<objAttribute name="booleanColumn" type="boolean" dbAttributePath="BOOLEAN_COLUMN"/>
		<objAttribute name="intColumn" type="int" dbAttributePath="INT_COLUMN"/>
	</objEntity>
</dataMap>
