<?xml version="1.0" encoding="utf-8"?>
<dataMap xmlns="http://cayenne.apache.org/schema/15/dataMap"
	 xmlns:xsi="http://www.w3.org/2001/XMLSchema-instance"
	 xsi:schemaLocation="http://cayenne.apache.org/schema/15/dataMap https://cayenne.apache.org/schema/15/dataMap.xsd"
	 defaultPackage="org.apache.cayenne.testdo.compound"
	 defaultSuperclass="org.apache.cayenne.GenericPersistentObject">
	<dbEntity name="CHAR_FK_TEST">
		<dbAttribute name="FK_COL" type="CHAR" length="10"/>
		<dbAttribute name="NAME" type="VARCHAR" length="100"/>
		<dbAttribute name="PK" type="INTEGER" primaryKey="true" mandatory="true"/>
	</dbEntity>
	<dbEntity name="CHAR_PK_TEST">
		<dbAttribute name="OTHER_COL" type="CHAR" length="10"/>
		<dbAttribute name="PK_COL" type="CHAR" primaryKey="true" mandatory="true" length="10"/>
	</dbEntity>
	<dbEntity name="COMPOUND_FK_TEST">
		<dbAttribute name="F_KEY1" type="VARCHAR" length="20"/>
		<dbAttribute name="F_KEY2" type="VARCHAR" length="20"/>
		<dbAttribute name="NAME" type="VARCHAR" length="255"/>
		<dbAttribute name="PKEY" type="INTEGER" primaryKey="true" mandatory="true"/>
	</dbEntity>
	<dbEntity name="COMPOUND_INT_PK">
		<dbAttribute name="id1" type="INTEGER" primaryKey="true" mandatory="true"/>
		<dbAttribute name="id2" type="INTEGER" primaryKey="true" mandatory="true"/>
		<dbAttribute name="name" type="VARCHAR" length="100"/>
	</dbEntity>
	<dbEntity name="COMPOUND_PK_TEST">
		<dbAttribute name="KEY1" type="VARCHAR" primaryKey="true" mandatory="true" length="20"/>
		<dbAttribute name="KEY2" type="VARCHAR" primaryKey="true" mandatory="true" length="20"/>
		<dbAttribute name="NAME" type="VARCHAR" length="255"/>
	</dbEntity>
	<dbEntity name="compound_order">
		<dbAttribute name="info" type="VARCHAR" length="255"/>
		<dbAttribute name="order_number" type="INTEGER" primaryKey="true" mandatory="true"/>
	</dbEntity>
	<dbEntity name="compound_order_line">
		<dbAttribute name="order_line_number" type="INTEGER" primaryKey="true" mandatory="true"/>
		<dbAttribute name="order_number" type="INTEGER" primaryKey="true" mandatory="true"/>
	</dbEntity>
	<dbEntity name="compound_order_line_info">
		<dbAttribute name="info" type="VARCHAR" length="255"/>
		<dbAttribute name="order_line_number" type="INTEGER" primaryKey="true" mandatory="true"/>
		<dbAttribute name="order_number" type="INTEGER" primaryKey="true" mandatory="true"/>
	</dbEntity>
	<dbEntity name="TWO_FK_A">
		<dbAttribute name="ID" type="INTEGER" primaryKey="true" mandatory="true"/>
		<dbAttribute name="NAME" type="VARCHAR" length="100"/>
	</dbEntity>
	<dbEntity name="TWO_FK_B">
		<dbAttribute name="ID" type="INTEGER" primaryKey="true" mandatory="true"/>
		<dbAttribute name="A_ID1" type="INTEGER"/>
		<dbAttribute name="A_ID2" type="INTEGER"/>
	</dbEntity>
	<objEntity name="CharFkTestEntity" className="org.apache.cayenne.testdo.compound.CharFkTestEntity" dbEntityName="CHAR_FK_TEST">
		<objAttribute name="name" type="java.lang.String" dbAttributePath="NAME"/>
	</objEntity>
	<objEntity name="CharPkTestEntity" className="org.apache.cayenne.testdo.compound.CharPkTestEntity" dbEntityName="CHAR_PK_TEST">
		<objAttribute name="otherCol" type="java.lang.String" dbAttributePath="OTHER_COL"/>
		<objAttribute name="pkCol" type="java.lang.String" dbAttributePath="PK_COL"/>
	</objEntity>
	<objEntity name="CompoundFkTestEntity" className="org.apache.cayenne.testdo.compound.CompoundFkTestEntity" dbEntityName="COMPOUND_FK_TEST">
		<objAttribute name="name" type="java.lang.String" dbAttributePath="NAME"/>
	</objEntity>
	<objEntity name="CompoundIntPk" className="org.apache.cayenne.testdo.compound.CompoundIntPk" dbEntityName="COMPOUND_INT_PK">
		<objAttribute name="id1" type="java.lang.Integer" dbAttributePath="id1"/>
		<objAttribute name="id2" type="java.lang.Integer" dbAttributePath="id2"/>
		<objAttribute name="name" type="java.lang.String" dbAttributePath="name"/>
	</objEntity>
	<objEntity name="CompoundOrder" className="org.apache.cayenne.testdo.compound.CompoundOrder" dbEntityName="compound_order" superClassName="org.apache.cayenne.GenericPersistentObject">
		<objAttribute name="info" type="java.lang.String" dbAttributePath="info"/>
	</objEntity>
	<objEntity name="CompoundOrderLine" className="org.apache.cayenne.testdo.compound.CompoundOrderLine" dbEntityName="compound_order_line" superClassName="org.apache.cayenne.GenericPersistentObject">
		<objAttribute name="lineNumber" type="int" dbAttributePath="order_line_number"/>
	</objEntity>
	<objEntity name="CompoundOrderLineInfo" className="org.apache.cayenne.testdo.compound.CompoundOrderLineInfo" dbEntityName="compound_order_line_info" superClassName="org.apache.cayenne.GenericPersistentObject">
		<objAttribute name="info" type="java.lang.String" dbAttributePath="info"/>
	</objEntity>
	<objEntity name="CompoundPkTestEntity" className="org.apache.cayenne.testdo.compound.CompoundPkTestEntity" dbEntityName="COMPOUND_PK_TEST">
		<objAttribute name="key1" type="java.lang.String" dbAttributePath="KEY1"/>
		<objAttribute name="key2" type="java.lang.String" dbAttributePath="KEY2"/>
		<objAttribute name="name" type="java.lang.String" dbAttributePath="NAME"/>
	</objEntity>
	<dbRelationship name="toCharPK" source="CHAR_FK_TEST" target="CHAR_PK_TEST" foreignKey="true">
		<dbAttributePair source="FK_COL" target="PK_COL"/>
	</dbRelationship>
	<dbRelationship name="charFKs" source="CHAR_PK_TEST" target="CHAR_FK_TEST" toMany="true">
		<dbAttributePair source="PK_COL" target="FK_COL"/>
	</dbRelationship>
	<dbRelationship name="toCompoundPk" source="COMPOUND_FK_TEST" target="COMPOUND_PK_TEST" foreignKey="true">
		<dbAttributePair source="F_KEY1" target="KEY1"/>
		<dbAttributePair source="F_KEY2" target="KEY2"/>
	</dbRelationship>
	<dbRelationship name="compoundFkArray" source="COMPOUND_PK_TEST" target="COMPOUND_FK_TEST" toMany="true">
		<dbAttributePair source="KEY1" target="F_KEY1"/>
		<dbAttributePair source="KEY2" target="F_KEY2"/>
	</dbRelationship>
	<dbRelationship name="lines" source="compound_order" target="compound_order_line" toMany="true">
		<dbAttributePair source="order_number" target="order_number"/>
	</dbRelationship>
	<dbRelationship name="info" source="compound_order_line" target="compound_order_line_info">
		<dbAttributePair source="order_number" target="order_number"/>
		<dbAttributePair source="order_line_number" target="order_line_number"/>
	</dbRelationship>
	<dbRelationship name="order" source="compound_order_line" target="compound_order" foreignKey="true">
		<dbAttributePair source="order_number" target="order_number"/>
	</dbRelationship>
	<dbRelationship name="line" source="compound_order_line_info" target="compound_order_line" foreignKey="true">
		<dbAttributePair source="order_number" target="order_number"/>
		<dbAttributePair source="order_line_number" target="order_line_number"/>
	</dbRelationship>
	<dbRelationship name="toA1" source="TWO_FK_B" target="TWO_FK_A" foreignKey="true">
		<dbAttributePair source="A_ID1" target="ID"/>
	</dbRelationship>
	<dbRelationship name="toA2" source="TWO_FK_B" target="TWO_FK_A" foreignKey="true">
		<dbAttributePair source="A_ID2" target="ID"/>
	</dbRelationship>
	<dbRelationship name="bs1" source="TWO_FK_A" target="TWO_FK_B" toMany="true">
		<dbAttributePair source="ID" target="A_ID1"/>
	</dbRelationship>
	<dbRelationship name="bs2" source="TWO_FK_A" target="TWO_FK_B" toMany="true">
		<dbAttributePair source="ID" target="A_ID2"/>
	</dbRelationship>
	<objRelationship name="toCharPK" source="CharFkTestEntity" target="CharPkTestEntity" dbRelationshipPath="toCharPK"/>
	<objRelationship name="charFKs" source="CharPkTestEntity" target="CharFkTestEntity" dbRelationshipPath="charFKs"/>
	<objRelationship name="toCompoundPk" source="CompoundFkTestEntity" target="CompoundPkTestEntity" dbRelationshipPath="toCompoundPk"/>
	<objRelationship name="lines" source="CompoundOrder" target="CompoundOrderLine" deleteRule="deny" dbRelationshipPath="lines"/>
	<objRelationship name="info" source="CompoundOrderLine" target="CompoundOrderLineInfo" deleteRule="nullify" dbRelationshipPath="info"/>
	<objRelationship name="order" source="CompoundOrderLine" target="CompoundOrder" deleteRule="nullify" dbRelationshipPath="order"/>
	<objRelationship name="line" source="CompoundOrderLineInfo" target="CompoundOrderLine" deleteRule="nullify" dbRelationshipPath="line"/>
	<objRelationship name="compoundFkArray" source="CompoundPkTestEntity" target="CompoundFkTestEntity" dbRelationshipPath="compoundFkArray"/>
</dataMap>
