<?xml version="1.0" encoding="utf-8"?>
<dataMap xmlns="http://cayenne.apache.org/schema/15/dataMap"
	 xmlns:xsi="http://www.w3.org/2001/XMLSchema-instance"
	 xsi:schemaLocation="http://cayenne.apache.org/schema/15/dataMap https://cayenne.apache.org/schema/15/dataMap.xsd"
	 defaultPackage="org.apache.cayenne.testdo.qualified"
	 quoteSqlIdentifiers="true">
	<dbEntity name="TEST_QUALIFIED1">
		<dbAttribute name="DELETED" type="BOOLEAN"/>
		<dbAttribute name="ID" type="INTEGER" primaryKey="true" mandatory="true"/>
		<dbAttribute name="NAME" type="VARCHAR" length="200"/>
	</dbEntity>
	<dbEntity name="TEST_QUALIFIED2">
		<dbAttribute name="DELETED" type="BOOLEAN"/>
		<dbAttribute name="ID" type="INTEGER" primaryKey="true" mandatory="true"/>
		<dbAttribute name="NAME" type="VARCHAR" length="200"/>
		<dbAttribute name="QUALIFIED1_ID" type="INTEGER"/>
	</dbEntity>
	<dbEntity name="TEST_QUALIFIED3">
		<dbAttribute name="DELETED" type="BOOLEAN"/>
		<dbAttribute name="ID" type="INTEGER" primaryKey="true" mandatory="true"/>
		<dbAttribute name="NAME" type="VARCHAR" length="200"/>
		<qualifier><![CDATA[DELETED = null]]></qualifier>
	</dbEntity>
	<dbEntity name="TEST_QUALIFIED4">
		<dbAttribute name="DELETED" type="BOOLEAN"/>
		<dbAttribute name="ID" type="INTEGER" primaryKey="true" mandatory="true"/>
		<dbAttribute name="NAME" type="VARCHAR" length="200"/>
		<dbAttribute name="QUALIFIED3_ID" type="INTEGER"/>
		<qualifier><![CDATA[DELETED = null]]></qualifier>
	</dbEntity>
	<objEntity name="Qualified1" className="org.apache.cayenne.testdo.qualified.Qualified1" dbEntityName="TEST_QUALIFIED1">
		<qualifier><![CDATA[deleted = null]]></qualifier>
		<objAttribute name="deleted" type="java.lang.Boolean" dbAttributePath="DELETED"/>
		<objAttribute name="name" type="java.lang.String" dbAttributePath="NAME"/>
	</objEntity>
	<objEntity name="Qualified2" className="org.apache.cayenne.testdo.qualified.Qualified2" dbEntityName="TEST_QUALIFIED2">
		<qualifier><![CDATA[deleted = null]]></qualifier>
		<objAttribute name="deleted" type="java.lang.Boolean" dbAttributePath="DELETED"/>
		<objAttribute name="name" type="java.lang.String" dbAttributePath="NAME"/>
	</objEntity>
	<objEntity name="Qualified3" className="org.apache.cayenne.testdo.qualified.Qualified3" dbEntityName="TEST_QUALIFIED3">
		<objAttribute name="name" type="java.lang.String" dbAttributePath="NAME"/>
	</objEntity>
	<objEntity name="Qualified4" className="org.apache.cayenne.testdo.qualified.Qualified4" dbEntityName="TEST_QUALIFIED4">
		<objAttribute name="name" type="java.lang.String" dbAttributePath="NAME"/>
	</objEntity>
	<dbRelationship name="qualified2s" source="TEST_QUALIFIED1" target="TEST_QUALIFIED2" toMany="true">
		<dbAttributePair source="ID" target="QUALIFIED1_ID"/>
	</dbRelationship>
	<dbRelationship name="qualified1" source="TEST_QUALIFIED2" target="TEST_QUALIFIED1" foreignKey="true">
		<dbAttributePair source="QUALIFIED1_ID" target="ID"/>
	</dbRelationship>
	<dbRelationship name="qualified4s" source="TEST_QUALIFIED3" target="TEST_QUALIFIED4" toMany="true">
		<dbAttributePair source="ID" target="QUALIFIED3_ID"/>
	</dbRelationship>
	<dbRelationship name="qualified3" source="TEST_QUALIFIED4" target="TEST_QUALIFIED3" foreignKey="true">
		<dbAttributePair source="QUALIFIED3_ID" target="ID"/>
	</dbRelationship>
	<objRelationship name="qualified2s" source="Qualified1" target="Qualified2" dbRelationshipPath="qualified2s"/>
	<objRelationship name="qualified1" source="Qualified2" target="Qualified1" dbRelationshipPath="qualified1"/>
	<objRelationship name="qualified4s" source="Qualified3" target="Qualified4" deleteRule="deny" dbRelationshipPath="qualified4s"/>
	<objRelationship name="qualified3" source="Qualified4" target="Qualified3" deleteRule="nullify" dbRelationshipPath="qualified3"/>
</dataMap>
