<?xml version="1.0" encoding="UTF-8"?>
<!--~~~~~~~~~~~~~~~~~~~~~~~~~~~~~~~~~~~~~~~~~~~~~~~~~~~~~~~~~~~~~~
  ~   Licensed to the Apache Software Foundation (ASF) under one
  ~  or more contributor license agreements.  See the NOTICE file
  ~  distributed with this work for additional information
  ~  regarding copyright ownership.  The ASF licenses this file
  ~  to you under the Apache License, Version 2.0 (the
  ~  "License"); you may not use this file except in compliance
  ~  with the License.  You may obtain a copy of the License at
  ~
  ~    https://www.apache.org/licenses/LICENSE-2.0
  ~
  ~  Unless required by applicable law or agreed to in writing,
  ~  software distributed under the License is distributed on an
  ~  "AS IS" BASIS, WITHOUT WARRANTIES OR CONDITIONS OF ANY
  ~  KIND, either express or implied.  See the License for the
  ~  specific language governing permissions and limitations
  ~  under the License.
  ~~~~~~~~~~~~~~~~~~~~~~~~~~~~~~~~~~~~~~~~~~~~~~~~~~~~~~~~~~~~~-->
<dataMap xmlns="http://cayenne.apache.org/schema/15/dataMap"
          xmlns:xsi="http://www.w3.org/2001/XMLSchema-instance"
          xsi:schemaLocation="http://cayenne.apache.org/schema/15/dataMap http://cayenne.apache.org/schema/15/dataMap.xsd">

    <dbEntity name="CHILD" schema="SCHEMA_01">
        <dbAttribute name="id" type="INTEGER" length="10"/>
        <dbAttribute name="parent_id" type="INTEGER" length="10"/>
    </dbEntity>
    <dbEntity name="PARENT" schema="SCHEMA_01">
        <dbAttribute name="id" type="INTEGER" primaryKey="true" mandatory="true" length="10"/>
    </dbEntity>
    <objEntity name="Child" className="Child" dbEntityName="CHILD">
    </objEntity>
    <objEntity name="Parent" className="Parent" dbEntityName="PARENT">
    </objEntity>
    <dbRelationship name="parent" source="CHILD" target="PARENT" foreignKey="true">
        <dbAttributePair source="parent_id" target="id"/>
    </dbRelationship>
    <dbRelationship name="children" source="PARENT" target="CHILD" toMany="true">
        <dbAttributePair source="id" target="parent_id"/>
    </dbRelationship>
    <objRelationship name="parent" source="Child" target="Parent" deleteRule="nullify" dbRelationshipPath="parent"/>
    <objRelationship name="children" source="Parent" target="Child" deleteRule="deny" dbRelationshipPath="children"/>
</dataMap>