<?xml version="1.0" encoding="utf-8"?>
<dataMap xmlns="http://cayenne.apache.org/schema/15/dataMap"
	 xmlns:xsi="http://www.w3.org/2001/XMLSchema-instance"
	 xsi:schemaLocation="http://cayenne.apache.org/schema/15/dataMap https://cayenne.apache.org/schema/15/dataMap.xsd"
	 defaultPackage="org.apache.cayenne.testdo.relationships_to_many_fk">
	<dbEntity name="TO_MANY_FKDEP">
		<dbAttribute name="DEP_ID" type="INTEGER" primaryKey="true" mandatory="true"/>
		<dbAttribute name="NAME" type="VARCHAR" length="200"/>
		<dbAttribute name="OTHER_ID" type="INTEGER" primaryKey="true" mandatory="true"/>
	</dbEntity>
	<dbEntity name="TO_MANY_FKROOT">
		<dbAttribute name="FK_ID" type="INTEGER"/>
		<dbAttribute name="ID" type="INTEGER" primaryKey="true" mandatory="true"/>
		<dbAttribute name="NAME" type="VARCHAR" length="100"/>
	</dbEntity>
	<dbEntity name="TO_MANY_ROOT2">
		<dbAttribute name="ID" type="INTEGER" primaryKey="true" mandatory="true"/>
		<dbAttribute name="NAME" type="VARCHAR" length="100"/>
	</dbEntity>
	<objEntity name="ToManyFkDep" className="org.apache.cayenne.testdo.relationships_to_many_fk.ToManyFkDep" dbEntityName="TO_MANY_FKDEP">
		<objAttribute name="depId" type="java.lang.Integer" dbAttributePath="DEP_ID"/>
		<objAttribute name="name" type="java.lang.String" dbAttributePath="NAME"/>
	</objEntity>
	<objEntity name="ToManyFkRoot" className="org.apache.cayenne.testdo.relationships_to_many_fk.ToManyFkRoot" dbEntityName="TO_MANY_FKROOT">
		<objAttribute name="depId" type="java.lang.Integer" dbAttributePath="FK_ID"/>
		<objAttribute name="name" type="java.lang.String" dbAttributePath="NAME"/>
	</objEntity>
	<objEntity name="ToManyRoot2" className="org.apache.cayenne.testdo.relationships_to_many_fk.ToManyRoot2" dbEntityName="TO_MANY_ROOT2">
		<objAttribute name="name" type="java.lang.String" dbAttributePath="NAME"/>
	</objEntity>
	<dbRelationship name="root" source="TO_MANY_FKDEP" target="TO_MANY_FKROOT">
		<dbAttributePair source="DEP_ID" target="FK_ID"/>
	</dbRelationship>
	<dbRelationship name="root2" source="TO_MANY_FKDEP" target="TO_MANY_ROOT2" foreignKey="true">
		<dbAttributePair source="OTHER_ID" target="ID"/>
	</dbRelationship>
	<dbRelationship name="deps" source="TO_MANY_FKROOT" target="TO_MANY_FKDEP" toMany="true">
		<dbAttributePair source="FK_ID" target="DEP_ID"/>
	</dbRelationship>
	<dbRelationship name="deps" source="TO_MANY_ROOT2" target="TO_MANY_FKDEP" toMany="true">
		<dbAttributePair source="ID" target="OTHER_ID"/>
	</dbRelationship>
	<objRelationship name="root" source="ToManyFkDep" target="ToManyFkRoot" dbRelationshipPath="root"/>
	<objRelationship name="root2" source="ToManyFkDep" target="ToManyRoot2" dbRelationshipPath="root2"/>
	<objRelationship name="deps" source="ToManyFkRoot" target="ToManyFkDep" dbRelationshipPath="deps"/>
	<objRelationship name="deps" source="ToManyRoot2" target="ToManyFkDep" dbRelationshipPath="deps"/>
</dataMap>
