<?xml version="1.0" encoding="utf-8"?>
<dataMap xmlns="http://cayenne.apache.org/schema/15/dataMap"
	 xmlns:xsi="http://www.w3.org/2001/XMLSchema-instance"
	 xsi:schemaLocation="http://cayenne.apache.org/schema/15/dataMap https://cayenne.apache.org/schema/15/dataMap.xsd"
	 defaultPackage="org.apache.cayenne.crypto.db">
	<dbEntity name="TABLE1">
		<dbAttribute name="CRYPTO_INT" type="BLOB"/>
		<dbAttribute name="CRYPTO_STRING" type="CLOB"/>
		<dbAttribute name="ID" type="INTEGER" primaryKey="true" mandatory="true"/>
		<dbAttribute name="PLAIN_INT" type="INTEGER"/>
		<dbAttribute name="PLAIN_STRING" type="VARCHAR" length="200"/>
	</dbEntity>
	<dbEntity name="TABLE2">
		<dbAttribute name="CRYPTO_BYTES" type="BLOB"/>
		<dbAttribute name="ID" type="INTEGER" primaryKey="true" mandatory="true"/>
		<dbAttribute name="PLAIN_BYTES" type="LONGVARBINARY"/>
	</dbEntity>
	<dbEntity name="TABLE3">
		<dbAttribute name="CRYPTO_BYTES" type="LONGVARBINARY"/>
		<dbAttribute name="ID" type="INTEGER" primaryKey="true" mandatory="true"/>
	</dbEntity>
	<dbEntity name="TABLE4">
		<dbAttribute name="ID" type="INTEGER" primaryKey="true" mandatory="true"/>
		<dbAttribute name="PLAIN_INT" type="INTEGER"/>
		<dbAttribute name="PLAIN_STRING" type="VARCHAR" length="200"/>
	</dbEntity>
	<dbEntity name="TABLE5">
		<dbAttribute name="CRYPTO_INT1" type="CLOB"/>
		<dbAttribute name="CRYPTO_INT2" type="BLOB"/>
		<dbAttribute name="CRYPTO_INT3" type="VARBINARY" length="255"/>
		<dbAttribute name="CRYPTO_INT4" type="BLOB"/>
		<dbAttribute name="ID" type="INTEGER" primaryKey="true" mandatory="true"/>
	</dbEntity>
	<dbEntity name="TABLE7">
		<dbAttribute name="CRYPTO_INT" type="BLOB"/>
		<dbAttribute name="CRYPTO_STRING" type="CLOB"/>
		<dbAttribute name="ID" type="INTEGER" primaryKey="true" mandatory="true"/>
		<dbAttribute name="TABLE1_ID" type="INTEGER"/>
	</dbEntity>
	<dbEntity name="TABLE8">
		<dbAttribute name="CRYPTO_BYTES" type="LONGVARBINARY"/>
		<dbAttribute name="ID" type="INTEGER" primaryKey="true" mandatory="true"/>
	</dbEntity>
	<objEntity name="Table1" className="org.apache.cayenne.crypto.db.Table1" dbEntityName="TABLE1">
		<objAttribute name="cryptoInt" type="int" dbAttributePath="CRYPTO_INT"/>
		<objAttribute name="cryptoString" type="java.lang.String" dbAttributePath="CRYPTO_STRING"/>
		<objAttribute name="plainInt" type="int" dbAttributePath="PLAIN_INT"/>
		<objAttribute name="plainString" type="java.lang.String" dbAttributePath="PLAIN_STRING"/>
	</objEntity>
	<objEntity name="Table2" className="org.apache.cayenne.crypto.db.Table2" dbEntityName="TABLE2">
		<objAttribute name="cryptoBytes" type="byte[]" dbAttributePath="CRYPTO_BYTES"/>
		<objAttribute name="plainBytes" type="byte[]" dbAttributePath="PLAIN_BYTES"/>
	</objEntity>
	<objEntity name="Table3" className="org.apache.cayenne.crypto.db.Table3" dbEntityName="TABLE3">
		<objAttribute name="cryptoString" type="java.lang.String" dbAttributePath="CRYPTO_BYTES"/>
	</objEntity>
	<objEntity name="Table4" className="org.apache.cayenne.crypto.db.Table4" dbEntityName="TABLE4">
		<objAttribute name="plainInt" type="int" dbAttributePath="PLAIN_INT"/>
		<objAttribute name="plainString" type="java.lang.String" dbAttributePath="PLAIN_STRING"/>
	</objEntity>
	<objEntity name="Table5" className="org.apache.cayenne.crypto.db.Table5" dbEntityName="TABLE5">
		<objAttribute name="cryptoInt1" type="int" dbAttributePath="CRYPTO_INT1"/>
		<objAttribute name="cryptoInt3" type="int" dbAttributePath="CRYPTO_INT3"/>
		<objAttribute name="cryptoInt4" type="int" dbAttributePath="CRYPTO_INT4"/>
	</objEntity>
	<objEntity name="Table6" className="org.apache.cayenne.crypto.db.Table6" dbEntityName="TABLE5">
		<objAttribute name="cryptoInt1" type="long" dbAttributePath="CRYPTO_INT1"/>
		<objAttribute name="cryptoInt4" type="int" dbAttributePath="CRYPTO_INT4"/>
	</objEntity>
	<objEntity name="Table7" className="org.apache.cayenne.crypto.db.Table7" dbEntityName="TABLE7">
		<objAttribute name="cryptoInt" type="int" dbAttributePath="CRYPTO_INT"/>
		<objAttribute name="cryptoString" type="java.lang.String" dbAttributePath="CRYPTO_STRING"/>
	</objEntity>
	<objEntity name="Table8" className="org.apache.cayenne.crypto.db.Table8" lockType="optimistic" dbEntityName="TABLE8">
		<objAttribute name="cryptoString" type="java.lang.String" lock="true" dbAttributePath="CRYPTO_BYTES"/>
	</objEntity>
	<dbRelationship name="table7s" source="TABLE1" target="TABLE7" toMany="true">
		<dbAttributePair source="ID" target="TABLE1_ID"/>
	</dbRelationship>
	<dbRelationship name="toTable1" source="TABLE7" target="TABLE1" foreignKey="true">
		<dbAttributePair source="TABLE1_ID" target="ID"/>
	</dbRelationship>
	<objRelationship name="table7s" source="Table1" target="Table7" deleteRule="deny" dbRelationshipPath="table7s"/>
	<objRelationship name="toTable1" source="Table7" target="Table1" deleteRule="nullify" dbRelationshipPath="toTable1"/>
</dataMap>
